<?xml version="1.0" encoding="UTF-8"?>
<bookstore
	xmlns="http://www.example.org/bookstore"
	xmlns:xsi="http://www.w3.org/2001/XMLSchema-instance"
	xsi:schemaLocation="http://www.example.org/bookstore bookstore.xsd ">
	
	<book isbn="98012349">
		<title>Desserts</title>
		<author>AIR</author>
		<price>10.0</price>
		<genre>kochen</genre>
		<count>10</count>
		<kind>hardcover</kind>
		<language>deutsch</language>
	</book>
	
	<book isbn="98012345">
		<title>Lord of the Rings</title>
		<author>Tolkien</author>
		<price>10.99</price>
		<genre>fantasy</genre>
		<count>10</count>
		<kind>softcover</kind>
		<language>englisch</language>
	</book>
	
	<book isbn="98012347">
		<title>DAS Schaf</title>
		<author>Shaun</author>
		<price>20.99</price>
		<genre>kinder</genre>
		<count>1</count>
		<kind>audio book</kind>
		<language>deutsch</language>
	</book>
	
	
</bookstore>


